"CaptureBase_BargainingChip.contractName";"Bargaining Chip";"Bargaining Chip";;;
"CaptureBase_SurveillanceOutpost.dialogueList7.dialogueContent0.words";"Commander, bad news. We're seeing energy signatures for fixed defenses powering up.";"Commander, bad news. We're seeing energy signatures for fixed defenses powering up.";;;
"CaptureBase_SurveillanceOutpost.dialogueList7.dialogueContent1.words";"Turrets. Remember they can spot you from a very long way off, Commander.";"Turrets. Remember they can spot you from a very long way off, Commander.";;;
"CaptureBase_SurveillanceOutpost.dialogueList8.dialogueContent0.words";"Sure enough, that facility isn't abandoned at all. We need to sweep it for hostiles and clear them out.";"Sure enough, that facility isn't abandoned at all. We need to sweep it for hostiles and clear them out.";;;
"CaptureBase_SurveillanceOutpost.dialogueList8.dialogueContent1.words";"Remember there may be more enemy units in the field, so stay alert.";"Remember there may be more enemy units in the field, so stay alert.";;;
"CaptureBase_SurveillanceOutpost.longDescription";"How relevant can intel from the ass end of nowhere really be? We're still being paid, so I suppose it doesn't matter, honestly.";"How relevant can intel from the ass end of nowhere really be? We're still being paid, so I suppose it doesn't matter, honestly.";;;
"CaptureBase_SurveillanceOutpost.objectiveList0.description";"The objective to scout the base that is being captured. Must be completed before the actual capture of the base.";"The objective to scout the base that is being captured. Must be completed before the actual capture of the base.";;;
"CaptureBase_SurveillanceOutpost.objectiveList0.title";"Scout the Outpost";"Scout the Outpost";;;
"CaptureBase_SurveillanceOutpost.objectiveList1.description";"The objective to optionally destroy the defenders of the base.";"The objective to optionally destroy the defenders of the base.";;;
"CaptureBase_SurveillanceOutpost.objectiveList1.title";"Destroy the Enemy Force";"Destroy the Enemy Force";;;
"CaptureBase_SurveillanceOutpost.objectiveList2.description";"The objective for the player to move into and capture the base.";"The objective for the player to move into and capture the base.";;;
"CaptureBase_SurveillanceOutpost.objectiveList2.title";"Occupy the Outpost";"Occupy the Outpost";;;
"CaptureBase_SurveillanceOutpost.objectiveList3.description";"HIDDEN TIMER, NO NEED TO EDIT: This is the hidden timer objective that will trigger the enemy reinforcements.";"HIDDEN TIMER, NO NEED TO EDIT: This is the hidden timer objective that will trigger the enemy reinforcements.";;;
"CaptureBase_SurveillanceOutpost.objectiveList3.title";"Hold Out as Enemies Counter Attack";"Hold Out as Enemies Counter Attack";;;
"CaptureBase_SurveillanceOutpost.objectiveList4.description";"This is a general objective to indicate the player must keep playing and eliminate enemies as they come.";"This is a general objective to indicate the player must keep playing and eliminate enemies as they come.";;;
"CaptureBase_SurveillanceOutpost.objectiveList4.title";"Pacify the Area Around the Outpost";"Pacify the Area Around the Outpost";;;
"CaptureBase_SurveillanceOutpost.objectiveList5.description";"The primary objective to destroy the force that tries to remove the player from the captured base.";"The primary objective to destroy the force that tries to remove the player from the captured base.";;;
"CaptureBase_SurveillanceOutpost.objectiveList5.title";"Destroy {TEAM_TAR.FactionDef.Demonym} Reinforcements";"Destroy {TEAM_TAR.FactionDef.Demonym} Reinforcements";;;
"CaptureBase_SurveillanceOutpost.objectiveList6.description";"The chunk controlled objective to destroy the turrets for the base, if the chunk is active.";"The chunk controlled objective to destroy the turrets for the base, if the chunk is active.";;;
"CaptureBase_SurveillanceOutpost.objectiveList6.title";"Eliminate Base Turrets";"Eliminate Base Turrets";;;
"CaptureBase_SurveillanceOutpost.shortDescription";"Unremarkable, empty systems like this one are the perfect location for covert intelligence gathering operations. We believe there's a {TEAM_TAR.FactionDef.Demonym} facility here on {TGT_SYSTEM.Name} doing exactly that. Monitoring the pattern of DropShips making landings on the planet has led {TEAM_EMP.FactionDef.Demonym} analysts to a remote, apparently empty facility. Until just a few days ago, when we picked up the unmasked signature of a 'Mech's fusion engine powering up. That facility isn't empty, and we want the data stored there.";"Unremarkable, empty systems like this one are the perfect location for covert intelligence gathering operations. We believe there's a {TEAM_TAR.FactionDef.Demonym} facility here on {TGT_SYSTEM.Name} doing exactly that. Monitoring the pattern of DropShips making landings on the planet has led {TEAM_EMP.FactionDef.Demonym} analysts to a remote, apparently empty facility. Until just a few days ago, when we picked up the unmasked signature of a 'Mech's fusion engine powering up. That facility isn't empty, and we want the data stored there.";;;
